{
  "claim_scope": "finite_two_sided_open_refinement_congruence",
  "correspondence": {
    "adapter_verified": false,
    "dictionary_readback_enforced": true,
    "kind": "proof_carrying_canonical_certificate",
    "source_readback_enforced": true,
    "vector_schema": "nmlt-m11-open-congruence-v1",
    "verified_execution_kernel_theorem": true,
    "verified_implementation_theorem": false
  },
  "evidence_id": "nmlt-open-congruence-evidence-v1:sha256:a846f78b7582add382b10bcc0d68eec2ded9ce3e682237bef14eccd2f5f8c5b3",
  "limitations": [
    "Safety-only finite exact-action profile; no liveness or fairness transport.",
    "No liveness, fairness, hidden-divergence, payload-subtyping, or circular-discharge result.",
    "The bounded Rust kernel is translated by pinned Charon/Aeneas; it now executes structural equality against a separately reconstructed expected numeric certificate before validation, and Lean proves successful bound execution exposes that readback decision and the validation contract. Rust independently reads every active dictionary and source field back. The rich encoder, reconstruction, and Rust readback implementations remain outside verified extraction.",
    "The correspondence profile deliberately requires one exact nominal payload universe across all four components and total visible action maps.",
    "The proved canonical projection retains the uncertainty upper-bound coordinate but not Rust uncertainty family/profile identity; the stronger family checks remain in nmlt-grades."
  ],
  "rust_controls": [
    "accepts_two_sided_contract_sound_congruence_and_invariant_transport",
    "rejects_connection_not_preserved_on_both_mapped_endpoints",
    "rejects_abstract_connection_outside_concrete_image",
    "rejects_stale_invariant_domain",
    "rejects_incomplete_component_boundary_mapping",
    "rejects_nonmonotone_composite_grade",
    "rejects_undischarged_rely_condition",
    "rejects_shared_affine_capability_between_components",
    "rejects_nonuniform_payload_universe_at_correspondence_boundary",
    "canonical_certificate_validator_fails_closed_after_mutation",
    "kernel_readback_rejects_dictionary_substitution",
    "kernel_readback_rejects_numeric_atom_substitution",
    "kernel_readback_rejects_active_action_omission",
    "verified_kernel_bound_rejects_certificate_substitution",
    "canonical_validator_rejects_kernel_capacity_overflow",
    "source_readback_rejects_action_name_substitution",
    "source_readback_rejects_resource_substitution",
    "source_readback_rejects_wiring_substitution",
    "shared_m11_congruence_vectors_bind_the_rust_controls"
  ],
  "schema_version": "1.0.0",
  "sources": {
    "entries": [
      {
        "path": "crates/nmlt-open-kernel/Cargo.toml",
        "sha256": "116bbe012b8aacd5088d4dc5f6f3ef521b7336ecb7411af4a8e087cfba74580e"
      },
      {
        "path": "crates/nmlt-open-kernel/src/lib.rs",
        "sha256": "4021e1b738d9b53f402bd7ea68434353b39e227079b6c079e8a7e84f69a367cb"
      },
      {
        "path": "crates/nmlt-temporal/src/lib.rs",
        "sha256": "8b1c55ec9ad6d768f0032ee9a9b7753c7697b7e85b8f42aac281d5aedf0acd2f"
      },
      {
        "path": "crates/nmlt-temporal/src/open.rs",
        "sha256": "670dd0a41e3e1e16b32cd511cd2e5e272119b2ff779c53bf0c3647017e10574e"
      },
      {
        "path": "crates/nmlt-temporal/src/open_congruence.rs",
        "sha256": "4f046662a7987270bb70a834a3c1acfc2004e42fc5d398820d140945dc7340a7"
      },
      {
        "path": "crates/nmlt-temporal/src/open_contract.rs",
        "sha256": "226bbc79929f7160c9cc5cc18f70b579b7c20ee69e9e02b75dcc3fe8f40d23b7"
      },
      {
        "path": "crates/nmlt-temporal/src/open_encoding.rs",
        "sha256": "c57936e3fc3486964f210bd200b03d5557ddcc7cb9f95a3ff83f6803a82bdbbe"
      },
      {
        "path": "crates/nmlt-temporal/src/open_refinement.rs",
        "sha256": "92ebaa15c10423777d05a65e7f250768c191cf346df2d9723f90b799f19f1b20"
      },
      {
        "path": "crates/nmlt-temporal/src/open_resources.rs",
        "sha256": "e6424935efe65479aa21e4a2cbf6cf1f8862967646af16ca61ed57bbc3f19ad0"
      },
      {
        "path": "mechanization/lean/NMLT.lean",
        "sha256": "5d390d388c3ac0ce2475b70b8e4762ac32556665d8defc565a1754a0d3123f6e"
      },
      {
        "path": "mechanization/lean/NMLT/Behavior/OpenComposition.lean",
        "sha256": "de68188b17f180dac387aab58a6691a5a38ac1ab29d50cc5a28dcac370c116ff"
      },
      {
        "path": "mechanization/lean/NMLT/Behavior/OpenEncodingCorrespondence.lean",
        "sha256": "cce035c4753307edcd41d0374084fd84e8e1ef06d558018e594076dc3db86e83"
      },
      {
        "path": "mechanization/lean/NMLT/Behavior/OpenKernelExecution.lean",
        "sha256": "5ecdac72bee35bac0828fbbd5d75c92e227e0f072f9dbf801d42908050ab87de"
      },
      {
        "path": "mechanization/lean/NMLT/Behavior/OpenKernelGenerated/Funs.lean",
        "sha256": "ee27dacedff846a3b57ddc9b2b984c43cca61470ecb6426c34a3e5723dc9ba55"
      },
      {
        "path": "mechanization/lean/NMLT/Behavior/OpenKernelGenerated/Types.lean",
        "sha256": "f400750e44229b26a98cdc0d2463642d9bdf297337569656cb217cb538efac8e"
      },
      {
        "path": "mechanization/lean/NMLT/Behavior/OpenKernelReadback.lean",
        "sha256": "fedc476ed43e654d09aee6d08e475e149e87929acf561d4868fb00f342b55318"
      },
      {
        "path": "mechanization/lean/NMLT/Behavior/OpenMappedCongruence.lean",
        "sha256": "93dd4160dafebe2d3b14071669691a4a4955f6bfc1a4c4c96e689ec412e8ff2b"
      },
      {
        "path": "mechanization/lean/NMLT/Behavior/OpenRefinement.lean",
        "sha256": "99ee5f640a3981206abac30abd562d7ec734b8ae338133a7df0e77a0e7e75b16"
      },
      {
        "path": "mechanization/lean/NMLT/Behavior/OpenResourceCongruence.lean",
        "sha256": "e422430035e4324cfd0db0fccbee50d8430b099f8ad15d8c5034d887dd95def7"
      },
      {
        "path": "mechanization/lean/NMLT/Behavior/OpenSourceReadback.lean",
        "sha256": "05deade4eb8121c70894b39fe1d323e76acfa8e1369847c27ca1191b076effc2"
      },
      {
        "path": "mechanization/lean/lakefile.toml",
        "sha256": "7220c1d89a71ab7a46568bfbaaef88037581edb650e228882c2397717638a33f"
      },
      {
        "path": "mechanization/lean/lean-toolchain",
        "sha256": "d98505f0e331ec8d3670abfe7b3e7f179f56a9ee827cd38b0c113a6e69c4b3fb"
      },
      {
        "path": "mechanization/vectors/m11-open-congruence-v1.json",
        "sha256": "086dba9997dbf55d938cbc99016d1e98a83f219ffdb4d73fd84d3bebb072e1fa"
      },
      {
        "path": "rust-toolchain.toml",
        "sha256": "0ceb751d66f44e50985538d239e0f5712acccb9f7e71a8afb56878f8fc2ba74a"
      },
      {
        "path": "schemas/open-congruence-evidence-v1.schema.json",
        "sha256": "144f41b48cf647cf9e61f9430d7ebaaa39f019b99fa87d3cea9159667da4a2c4"
      },
      {
        "path": "tools/check_m11_congruence_correspondence.py",
        "sha256": "d3015f8684ab1c5f90799f54f064a5028a6578ee6647169014193843265f8bdb"
      },
      {
        "path": "tools/check_open_congruence_evidence.py",
        "sha256": "1282893ac77f239591ab36abd5dbddb7babbefc117a6802b0031cac64997ad97"
      }
    ],
    "source_set_id": "nmlt-open-congruence-source-set-v1:sha256:c27de219b0417a6d4f029344c1d017491528acc037b220432bc5238ed32ec923",
    "vector_sha256": "086dba9997dbf55d938cbc99016d1e98a83f219ffdb4d73fd84d3bebb072e1fa"
  },
  "statement": "Two independently checked finite open refinements lift through exact bijective wiring to a contract-checked product refinement, with finite reachable-state invariant transport, affine capability partitioning, monotone grades and rely discharge across every structural product-action case, plus a dictionary-readback-bound executable kernel contract.",
  "theorem_audits": [
    {
      "declared_axioms": [],
      "handle": "NMLT.Behavior.OpenComposition.StrongRefinement.parallelStepCongruenceRight",
      "role": "two_sided_lifting"
    },
    {
      "declared_axioms": [],
      "handle": "NMLT.Behavior.OpenComposition.StrongRefinement.twoSidedCompositionCongruence",
      "role": "two_sided_lifting"
    },
    {
      "declared_axioms": [],
      "handle": "NMLT.Behavior.OpenComposition.StrongRefinement.preservesComposableRightUnderWiring",
      "role": "contract_soundness"
    },
    {
      "declared_axioms": [],
      "handle": "NMLT.Behavior.OpenComposition.StrongRefinement.transportInvariant",
      "role": "invariant_transport"
    },
    {
      "declared_axioms": [],
      "handle": "NMLT.Behavior.OpenMappedCongruence.MappedWiringEquivalent.leftConnected_iff",
      "role": "contract_soundness"
    },
    {
      "declared_axioms": [],
      "handle": "NMLT.Behavior.OpenMappedCongruence.MappedWiringEquivalent.rightConnected_iff",
      "role": "contract_soundness"
    },
    {
      "declared_axioms": [],
      "handle": "NMLT.Behavior.OpenMappedCongruence.MappedRefinement.parallelStepCongruence",
      "role": "two_sided_lifting"
    },
    {
      "declared_axioms": [],
      "handle": "NMLT.Behavior.OpenMappedCongruence.MappedRefinement.liftParallel",
      "role": "two_sided_lifting"
    },
    {
      "declared_axioms": [],
      "handle": "NMLT.Behavior.OpenMappedCongruence.MappedRefinement.transportInvariant",
      "role": "invariant_transport"
    },
    {
      "declared_axioms": [],
      "handle": "NMLT.Behavior.OpenMappedCongruence.MappedRefinement.abstractPortCovered",
      "role": "contract_soundness"
    },
    {
      "declared_axioms": [],
      "handle": "NMLT.Behavior.OpenMappedCongruence.MappedRefinement.abstractAssumptionIncluded",
      "role": "contract_soundness"
    },
    {
      "declared_axioms": [],
      "handle": "NMLT.Behavior.OpenMappedCongruence.MappedRefinement.concreteGuaranteeIncluded",
      "role": "contract_soundness"
    },
    {
      "declared_axioms": [],
      "handle": "NMLT.Behavior.OpenMappedCongruence.Examples.positiveMappedProduct",